id,source,channel,date,title,full_text,word_count,url,tags,scraped_at,upvotes,comments,score,upvote_ratio,flair
2e152c63-b30c-4a49-9ae4-ec71afb6f3e7,TheDefiant,rss,"Mon, 02 Mar 2026 17:15:48 GMT","BTC, ETH Spot ETFs Reverse Weekly Outflow Streak","Both Bitcoin (BTC) and Ethereum (ETH) spot exchange-traded funds (ETF) closed out last week in the green, a reversal from a period of multi-week outflows. After five straight weeks of net negative flows, Bitcoin spot ETFs recorded net inflows of $787.31 million for the week ending on Feb. 27, bringing total net assets to $83.4 billion, per data fromSoSoValue. The previous three weeks of February all saw over $300 million in net outflows for BTC funds, while the last two weeks of January recorded over $1 billion in net outflows from the products. Ethereum ETFs also saw a renewed interest last week, with net inflows totaling $80.46 million during the same timeframe, also reversing a five-week net outflow streak. Despite the final weeks of last month shifting to the green, BTC and ETH ETFs were net negative for the month of February. However, the monthly losses for Bitcoin products were milder compared to the previous three months. The flow reversal indicates renewed institutional investor interest in crypto exposure, while spot prices remain in a tight range since early February, after losing previous support levels. While crypto markets are experiencing a broad recovery today, March 2, February was a rough month for both BTC and ETH. Bitcoin closed the month about 15% down, per data fromCoinGlass, while ETH lost 17% last month. This article was generated with the assistance of AI workflows. Know what matters in Crypto and Web3 with The Defiant Daily newsletter, Mon to Fri 90k+ Defiers informed every day. Unsubscribe anytime.",253,https://thedefiant.io/news/tradfi-and-fintech/crypto-spot-etfs-reverse-negative-weekly-flows,,2026-03-15 16:40,,,,,
41530054-862c-410c-9510-5e3e5e9adeb0,TheDefiant,rss,"Mon, 02 Mar 2026 13:31:10 GMT","Aave’s “Aave Will Win” Proposal Passes Temp Check, Advancing Governance Shift","The ""Aave Will Win"" governance proposal has successfully passed the Temp Check vote, garnering 52.58% support, and is now progressing to the Aave Request for Final Comment (ARFC) stage, marking a significant step for Aave's future development.",37,https://thedefiant.io/news/defi/aave-s-aave-will-win-proposal-advances-with-community-backing,,2026-03-15 16:40,,,,,
219a1cf5-fcf7-426c-b4cd-2aa27fe8b9d1,TheDefiant,rss,"Fri, 27 Feb 2026 16:41:39 GMT",Crypto Worth $580 Million Seized from Chinese Transnational Criminal Networks,"The U.S. Department of Justice has announced a significant cryptocurrency seizure linked to Chinese transnational criminal networks, part of a broader initiative to combat global scams.",26,https://thedefiant.io/news/regulation/crypto-worth-usd580-million-seized-from-chinese-transnational-criminal-networks,,2026-03-15 16:40,,,,,
f374f9cb-7506-407b-a71f-5c0e6ecc551e,TheDefiant,rss,"Fri, 27 Feb 2026 15:54:05 GMT",Barclays Evaluates Blockchain-based Settlement,"Barclays is evaluating technology providers for a new platform to integrate stablecoins and tokenized deposits, according to a report fromBloomberg. The British banking giant is exploring blockchain-based settlement systems in response to growing demand, and could pick a vendor as soon as April, according to people familiar with the matter. Barclays’ recent activities signify a shift from itspreviously cautious stanceto active investment in blockchain infrastructure. This change aligns with the evolving financial landscape, influenced by regulatory developments like the US GENIUS Act, which established a framework for dollar-backed tokens, and has encouraged institutions to explore blockchain and digital currencies more aggressively. Moreover, Barclays has joined a bank-led consortium to explore a reserve-backed digital currency using public blockchain technology. This initiative focuses on G7-pegged assets to enhance cross-border settlements, as highlighted by the Financial Times. Barclays' potential embrace of blockchain is part of a broader trend among major financial institutions, including JPMorgan and HSBC, who are also investing in digital infrastructure. This strategic direction by Barclays underscores the growing importance of blockchain technology in traditional finance, with stablecoins playing a crucial role in future payment systems. This article was generated with the assistance of AI workflows. Know what matters in Crypto and Web3 with The Defiant Daily newsletter, Mon to Fri 90k+ Defiers informed every day. Unsubscribe anytime.",217,https://thedefiant.io/news/tradfi-and-fintech/barclays-evaluates-blockchain-based-settlement,,2026-03-15 16:40,,,,,
ea2bdc0f-5bd8-42bf-a9c9-2af841f42c45,TheDefiant,rss,"Fri, 27 Feb 2026 15:33:15 GMT",MoonPay and M0 Launch PYUSDx Stablecoin Development Framework,"MoonPay and M0 have introduced PYUSDx, a platform aimed at simplifying the creation and management of application-specific stablecoins backed by Paypal's PYUSD.",22,https://thedefiant.io/news/defi/moonpay-and-m0-launch-pyusdx-stablecoin-development-framework,,2026-03-15 16:40,,,,,
efdf6fc3-7b13-462f-b2fb-4523a47f3488,TheDefiant,rss,"Thu, 26 Feb 2026 22:36:19 GMT",Decibel Perpetuals Exchange Launches on Aptos,"Decibel, a perpetual derivatives decentralized exchange (DEX) incubated by Aptos Labs, launched its mainnet today alongside its official points program. The DEX is starting with perpetual markets, before expanding to spot and real-world assets (RWAs), similar to the progression taken by market leaders Hyperliquid and Lighter. According to a press release shared with The Defiant, Decibel’s testnet generated “over 1 million user trades per day” across more than 130,000 daily active users (DAU). So far, the DEX has processed $6.4 million in volume since its mainnet launch and hosts $57 million in total value locked (TVL), according toDeFiLlama. The DEX is based on a central limit order book (CLOB) model, and hosts its risk engine onchain, ensuring functions such as auto-deleveraging are directly verifiable via the block explorer. While Aptos Labs incubated Decibel and the DEX is built on the Aptos Layer 1, the DEX also uses X-chain accounts to enable deposits from Ethereum and Solana. The perpetual market remains red hot, with more than$730 billiontraded across all DEXs in February, roughly the same amount traded throughout all of 2023. Activity has cooled off since volumes peaked at $1.37 trillion in October, but the sector remains one of the most popular in DeFi. Brylee Whatley, the Head of the Decibel Foundation, told The Defiant, “On the acquisition side, Decibel has invested heavily in aligning incentives with real usage. Season 1 of our Amps points program is live and is designed to reward genuine trading activity. But incentives only get users through the door.” “What keeps traders is trust in the system they are trading on. Everything on Decibel is transparent - the infrastructure, risk approach and liquidation logic. We built an exchange where serious traders feel confident deploying real capital,” they added. While a majority of DEXs offer tokenized equity and commodity offerings, only HyperUnit’s TradeXYZ, Lighter’s tokenized Korean stocks, and Ostium have found sustained liquidity and success. Whatley also touched on the future vision for Decibel as it enters the highly competitive tokenized RWA trading space, citing Aptos’ existing success in the world of RWAs and the chain’s global go-to-market reach. “Imagine using tokenized RWA holdings - treasuries, equities, commodities - as collateral to trade perpetuals, or using your crypto portfolio to margin equity positions. That kind of cross-asset capital efficiency is impossible at a traditional brokerage and isn't available on other DEXs,” Whatley concluded. Know what matters in Crypto and Web3 with The Defiant Daily newsletter, Mon to Fri 90k+ Defiers informed every day. Unsubscribe anytime.",418,https://thedefiant.io/news/defi/decibel-perpetuals-exchange-launches-on-aptos,,2026-03-15 16:40,,,,,
1ca361f8-c666-4663-a00f-915c8168a298,TheDefiant,rss,"Thu, 26 Feb 2026 21:35:18 GMT",Ethereum Foundation Outlines ‘Strawmap’ Through 2029,"The Ethereum Foundation (EF) has shared a long-term plan, dubbed the “strawmap,” that outlines how Ethereum could evolve over the rest of the decade, with goals including faster transactions and higher capacity. The roadmap lays out several possible changes across Ethereum’s core layers. If completed, it would mark the biggest evolution of the network sinceThe Mergein 2022, which moved Ethereum from proof-of-work to proof-of-stake. The plan underscores how Ethereum developers are preparing the network for more users and more activity by gradually improving speed, security, and reliability. Ethereum co-founder Vitalik Buterin described the roadmap as a “very important document” in aposton X. Ethereum is currently the world’s largest smart contract blockchain, with more than $56 billion in total value locked (TVL) across decentralized finance, according to DefiLlama. Following the news, Ether (ETH) briefly moved higher. The token is currently trading at $2,030 – down about 2% on the day but still up more than 4% over the past week. The strawmap outlines a long-term path with around seven forks through 2029. Justin Drake, a member of the EF Architecture team, explained in aposton X that the roadmap is built around five “north stars.” These include making the main network faster through shorter block times and near-instant finality, increasing capacity to roughly 10,000 transactions per second on Layer 1, scaling Layer 2 networks to as much as 10 million transactions per second, introducing post-quantum cryptography, and adding native privacy through shielded ETH transfers. “The strawmap is an invitation to view L1 protocol upgrades through a holistic lens,” Drake said. “By placing proposals on a single visual, it provides a unified perspective on Ethereum L1 ambitions.” Meanwhile, Buterin described the roadmap as a gradual revamp of Ethereum’s core systems, in which slot times, consensus, and cryptography are replaced bit by bit rather than through a single large overhaul. The new roadmap builds on Ethereum’s recent upgrades, includingFusaka, which launched in December 2025. That upgrade introduced the PeerDAS data availability system to help the network process more transactions while keeping fees low. However, while the upgrade marked a major step in the network’s scaling strategy, cheaper transactions have alsocoincided with a rise in spam and address-poisoning attacks, The Defiant previously reported. Know what matters in Crypto and Web3 with The Defiant Daily newsletter, Mon to Fri 90k+ Defiers informed every day. Unsubscribe anytime.",390,https://thedefiant.io/news/blockchains/ethereum-foundation-outlines-strawmap-through-2029,,2026-03-15 16:40,,,,,
83ede427-0ff7-4d44-a23a-5f268d2b7dd1,TheDefiant,rss,"Thu, 26 Feb 2026 21:14:36 GMT",Korean CEX Listings Continue to Boost Altcoins,"The Korean bid is becoming altcoin holders’ best friend these days, asKorean traders pile into new listingson the country's leading centralized exchanges (CEXs). Over the last week, South Korean CEXs Bithumb and UpBit listed two mid-sized altcoins, Centrifuge’s CFG and Espresso’s ESP, and both tokens surged. CFG rallied177%from $0.088 to $0.24, and ESP jumped by103%to $0.195. The Bithumb and UpBit effects have become common at this point, and Korean CEXs have been responsible for plenty of one-time pumps in small- to mid-sized altcoins. While these CEX traders are happy to jump in and speculate on new listings, the effect usually wears off in a few days to weeks as volumes return to their pre-listing levels. Korean CEX Bithumb also made headlines earlier this month afteraccidentally sending more than 200 users 2,000 BTC, worth $140 million at the time, instead of 2,000 WON. The “airdrop” resulted in BTC dropping 18% below the actual market price on Bithumb as recipients rushed to sell the tokens and offramp the funds; however, the exchange successfully froze “most” of the accounts before funds could be withdrawn. Know what matters in Crypto and Web3 with The Defiant Daily newsletter, Mon to Fri 90k+ Defiers informed every day. Unsubscribe anytime.",203,https://thedefiant.io/news/markets/korean-cex-listings-continue-to-boost-altcoins,,2026-03-15 16:40,,,,,
443d7f1b-6ef2-478b-b5bd-71363251a4ad,TheDefiant,rss,"Thu, 26 Feb 2026 21:02:26 GMT",Circle Stock Jumps 40% on Q4 Earnings,"Circle’s stock, CRCL, isup 40%over the last two trading days after the company unveiled itsQ4 2025 report, showcasing a 64% increase in revenue and 104% growth in earnings year over year (YoY). The report sent CRCL rallying from $61 per share to $86.25, as the company also shared an 82% increase in total USDC minted and a 59% increase in what it calls “meaningful wallets,” defined as any onchain wallet holding more than 10 USDC. The stock appears to be pricing in future growth, as the company still posted a net loss of $70 million in 2025, “significantly impacted by $424 million for stock-based compensation.” The company also touched on its upcomingLayer 1 stablechain, Arc, which launched its testnet in October. In addition to Arc’s impending mainnet launch, Circle CEO Jeremy Allaire also revealed that Circle isexploring a native tokenfor the Arc blockchain, but did not reveal any further details. While the earnings report and subsequent rebound offer some relief for shareholders, CRCL is still down 71% from its all-time high of $300, reached shortly after itsinitial public offering (IPO). Know what matters in Crypto and Web3 with The Defiant Daily newsletter, Mon to Fri 90k+ Defiers informed every day. Unsubscribe anytime.",202,https://thedefiant.io/news/tradfi-and-fintech/circle-stock-jumps-40-on-q4-earnings,,2026-03-15 16:40,,,,,
0a338c9d-915a-40ab-a9ec-baee16b43b6f,TheDefiant,rss,"Thu, 26 Feb 2026 19:07:32 GMT",PIPPIN Jumps 23% as AI and Meme Tokens Gain Momentum,"PIPPIN, an AI-driven memecoin on the Solana blockchain, surged 23% over the past 24 hours, outperforming large-cap cryptocurrencies as traders rotated into narrative-focused tokens. The coin is currently hovering around $0.87, up 70% over the past week and 169% over the past month. It boasts a market capitalization of around $870 million, with daily trading volume above $70 million, according to CoinGecko. The rally comes as AI-linked tokens have regained attention across crypto markets in recent days. The AI token sector’s market cap today is $13.8 billion, up 5.6% over 24 hours. The meme-coin market is also higher at $34.6 billion, up 4.7%, with PIPPIN leading the surge. Meanwhile, the global cryptocurrency market cap stands at $2.38 trillion, down 2.2% on the day. PIPPIN’s move also reflects a broader trend of markets reacting to AI narratives, where evenhypothetical scenarios have recently moved stocks and crypto. However, some experts say the rally has no clear driver. “The PIPPIN AI-meme token has been going up since early December 2025. There isn't too much known about why,” Nicolai Sondergaard, research analyst at Nansen, told The Defiant. “In addition, much of the supply is on exchanges (GATE), which further reduces the likelihood of understanding what is going on.” Sondergaard explained that there also aren't many smart money or public figures in it anymore, and that a majority of the top holders are labeled on-chain as ""investment recipients."" “This could insinuate somewhat centralized control,” Sondergaard added. “Alas, this cannot be proven or disproven at this point, even if accusations such as these have been flying around on CT."" CoinGecko also cautioned traders to do their research before trading PIPPIN, as Bubblemap data found that 80% of its supply is controlled by interconnected insider wallets. Know what matters in Crypto and Web3 with The Defiant Daily newsletter, Mon to Fri 90k+ Defiers informed every day. Unsubscribe anytime.",311,https://thedefiant.io/news/markets/pippin-jumps-23-as-ai-and-meme-tokens-gain-momentum,,2026-03-15 16:40,,,,,
89a49bca-7156-4d48-95c1-074a67b32b9f,TheDefiant,rss,"Thu, 26 Feb 2026 17:44:15 GMT",Bitcoin Hovers Near $67K as Crypto Markets Consolidate,"Crypto markets dipped slightly on Thursday, with the total market cap dropping by about 2% over the past day to around $2.39 trillion. Bitcoin (BTC) is trading near $67,000, down 2% over the past day but up 1% for the week, slightly below Wednesday’s peak. Ethereum (ETH) slipped to $1,992, posting a 3% daily loss. Among other Top 10 assets, Solana (SOL) dropped 3.5%, XRP plunged 5%, and BNB fell 1.5%. Analysts at glassnode noted inan X posttoday that “profit-taking continues to absorb momentum at the $70K threshold,” implying that this is consistent with a thin liquidity regime where even modest realization events are sufficient to suppress recovery attempts. “Historically, breaks below 1 have persisted for 6+ months before reclaiming it, a recovery that typically signals a constructive return of liquidity to the market,” they added. Paul Howard, senior director at crypto trading firm Wincent, said in commentary for The Defiant that stronger-than-expected earnings overnight had lifted tech stocks and risk assets more broadly. He noted that “the short squeeze on Circle was notable, alongside the significant short interest in MSTR and the earnings beat from NVDA,” adding that these moves contributed to Bitcoin’s rally over the past 24 hours. Howard added that the market is still looking for a clear catalyst that could push cryptocurrencies significantly higher, rather than just supporting them as a hedge trade. Among theTop 100 assetsby market cap, Pippin (PIPPIN) led gains with an 18.4% jump, followed by Internet Computer (ICP), which is up 8.5%. On the downside, Cosmos Hub (ATOM) fell 7.9%, and Morpho (MORPHO) declined 3.6%. CoinGlass reports that more than 157,000 traders were liquidated over the past 24 hours for a total of $560 million. Shorts dominated with around $420 million liquidated, compared with nearly $148 million in long positions. Spot Bitcoin ETFs saw inflows of $506 million on Wednesday, Feb. 25, the largest single-day inflow since Jan. 5, bringing total net assets to $87.6 billion. On that same day, spot Ethereum ETFs added $157 million, bringing cumulative net assets to $11.8 billion. On the macro front, U.S. Treasury yields were mostly flat. The 10-year note slipped slightly to 4.042%, the 30-year bond yield edged down to 4.687%, and the 2-year note ticked higher to 3.473%. Thursday’s Labor Department report showed initial unemployment claims for the week ended Feb. 21 at 212,000, slightly above the prior week’s revised 208,000 but below the 215,000 forecast, CNBCreported. On the geopolitical side, Iran’s foreign ministry said today’s nuclear talks in Geneva produced “very constructive” proposals, but didn’t give any details,accordingto the Associated Press. The U.S. and Iran are negotiating indirectly, with Oman’s foreign minister and the UN’s nuclear watchdog also present. Know what matters in Crypto and Web3 with The Defiant Daily newsletter, Mon to Fri 90k+ Defiers informed every day. Unsubscribe anytime.",468,https://thedefiant.io/news/markets/bitcoin-hovers-near-usd67k-as-crypto-markets-consolidate,,2026-03-15 16:40,,,,,
4044e578-e5f7-4622-991f-a90c38a527e8,TheDefiant,rss,"Thu, 26 Feb 2026 17:02:22 GMT",Ransomware Payments Topped $800 Million in 2025: Chainalysis,"Ransomware crypto payments stalled for a second year in 2025, even as attacks hit record levels and ransom demands jumped. Data fromChainalysisshows that total on-chain payments fell about 8% from a year earlier to roughly $820 million, while claimed attacks rose by about 50%. The biggest shift was in how much victims paid when they did give in. The median ransom payment surged 368% year-over-year to nearly $60,000 from about $12,700 in 2024. Jackie Koven, head of cyber threat intelligence at Chainalysis, told The Defiant that the surge in median payment is “likely not related to price,” adding that ransomware actors “anchor their extortion demands in USD or other fiat currencies, not BTC.” “So if they are demanding $1M, as an example, it doesn’t matter whether BTC is priced at 1M or 10k. The increase in median ransom is more likely related to high outlier payments rather than a return to big-game hunting ransomware tactics that dominated in the past,” Koven explained. Only 28% of victims paid a ransom in 2025, the lowest rate on record. “This overall trend is a major win against the ransomware ecosystem. Fewer victim payments mean more work for less for attackers, an important step in shifting the economic incentives,” the report reads. There were still several high-impact incidents that shaped the year. A cyberattack on Jaguar Land Rover in late August 2025halted productionacross multiple countries and caused an estimated $2.5 billion in damage, the costliest cyber incident in UK history. Retailers and hospitals were also hit hard. Major British multinational retailer Marks & Spencersuffered long outagesafter an attack tied to the Scattered Spider group, while global healthcare provider DaVitareportedexposure of nearly 2.7 million patient records. The U.S. stayed the top target worldwide, with Canada, Germany, and the UK behind it, and attacks rose sharply in manufacturing, finance, supply chains, and critical infrastructure, Chainalysis says. Know what matters in Crypto and Web3 with The Defiant Daily newsletter, Mon to Fri 90k+ Defiers informed every day. Unsubscribe anytime.",332,https://thedefiant.io/news/research-and-opinion/ransomware-payments-topped-usd800-million-in-2025-chainalysis,,2026-03-15 16:40,,,,,
1ad50a0c-54de-403c-87f5-001680c9967e,CoinCenter,rss,"Tue, 17 Feb 2026 16:20:38 +0000",Do Not Sacrifice Developer Protections in Market Structure,Coin Center's letter to members of the Senate Banking Committee on the importance of developer protections under the Blockchain Regulatory Certainty Act. The post Do Not Sacrifice Developer Protections in Market Structure appeared first on Coin Center .,38,https://www.coincenter.org/do-not-sacrifice-developer-protections-in-market-structure/,Blog,2026-03-15 16:40,,,,,
b684689a-29b5-4d5d-9b06-509d8b68e244,CoinCenter,rss,"Wed, 14 Jan 2026 21:44:46 +0000",Senate Banking Nears Vote on Digital Asset Market Structure,Why the current draft largely gets developer protections right The post Senate Banking Nears Vote on Digital Asset Market Structure appeared first on Coin Center .,26,https://www.coincenter.org/senate-banking-nears-vote-on-digital-asset-market-structure/,Blog,2026-03-15 16:40,,,,,
5ab84ec5-aef6-4d11-a5f1-ed2ea870342e,CoinCenter,rss,"Wed, 07 Jan 2026 20:15:12 +0000",Six Ways Congress Can Make Crypto Taxes Work for Everyday Users,"The six priorities outlined focus on easing administrative burdens for individual users, aligning crypto tax treatment with longstanding principles in other areas of tax law, and ensuring fairness and neutrality so that cryptocurrency usage is neither penalized nor privileged relative to comparable activity in the traditional economy. The post Six Ways Congress Can Make Crypto Taxes Work for Everyday Users appeared first on Coin Center .",66,https://www.coincenter.org/six-ways-congress-can-make-crypto-taxes-work-for-everyday-users/,Research Report,2026-03-15 16:40,,,,,
